id,grade,source,content,summary
50001,5,https://www.eiken.or.jp/eiken-iba/sample.html,,子ども同士がペットについて話している簡単な会話。
50002,4,https://www.eiken.or.jp/eiken-iba/sample.html,,母親と息子が週末の予定を相談する短い対話。
50003,3,https://www.eiken.or.jp/eiken-iba/sample.html,,友人同士が電話で映画に行く計画を立てている会話。
50004,Pre-2,https://www.eiken.or.jp/eiken-iba/sample.html,,A teacher gives a short announcement about a coming school field trip.
50005,2,https://www.eiken.or.jp/eiken-iba/sample.html,,Two coworkers are discussing preparations for an upcoming business meeting.
50006,Pre-1,https://www.eiken.or.jp/eiken-iba/sample.html,,A radio news report describes a recent environmental conservation event in the local community.
50007,1,https://www.eiken.or.jp/eiken-iba/sample.html,,A scientist is giving a presentation on new findings in renewable energy research.
